Corpse Bride,"Animation, Drama, Family",77 min,2005,"Tim Burton, Mike Johnson",7.3,"286,374",84%,"Johnny Depp, Helena Bonham Carter, Emily Watson",tt0121164,movie,PG,23-Sep-05,"Tim Burton, Carlos Grangel, John August","United States, United Kingdom",Nominated for 1 Oscar. 9 wins & 30 nominations total,"When a shy groom practices his wedding vows in the inadvertent presence of a deceased young woman, she rises from the grave assuming he has married her.",yes,no,
Sleeping Beauty,"Animation, Adventure, Family",75 min,1959,"Les Clark, Clyde Geronimi, Eric Larson",7.2,"155,535",89%,"Mary Costa, Bill Shirley, Eleanor Audley",tt0053285,movie,G,29-Jan-59,"Erdman Penner, Charles Perrault, Joe Rinaldi",United States,Nominated for 1 Oscar. 3 wins & 5 nominations total,"After being snubbed by the royal family, a malevolent fairy places a curse on a princess which only a prince can break, along with the help of three good fairies.",yes,no,
Cars,"Animation, Adventure, Comedy",117 min,2006,"John Lasseter, Joe Ranft",7.2,"445,600",75%,"Owen Wilson, Bonnie Hunt, Paul Newman",tt0317219,movie,G,9-Jun-06,"John Lasseter, Joe Ranft, Jorgen Klubien",United States,Nominated for 2 Oscars. 28 wins & 34 nominations total,"On the way to the biggest race of his life, a hotshot rookie race car gets stranded in a rundown town and learns that winning isn't everything in life.",yes,no,
Mulan,"Animation, Adventure, Comedy",87 min,1998,"Tony Bancroft, Barry Cook",7.6,"303,031",86%,"Ming-Na Wen, Eddie Murphy, BD Wong",tt0120762,movie,G,19-Jun-98,"Robert D. San Souci, Rita Hsiao, Chris Sanders","United States, Japan",Nominated for 1 Oscar. 17 wins & 21 nominations total,"To save her father from death in the army, a young maiden secretly goes in his place and becomes one of China's greatest heroines in the process.",yes,no,
Brave,"Animation, Adventure, Comedy",93 min,2012,"Mark Andrews, Brenda Chapman, Steve Purcell",7.1,"426,988",79%,"Kelly Macdonald, Billy Connolly, Emma Thompson",tt1217209,movie,PG,19-Jun-12,"Brenda Chapman, Mark Andrews, Steve Purcell","United States, Japan",Won 1 Oscar. 20 wins & 48 nominations total,"Determined to make her own path in life, Princess Merida defies a custom that brings chaos to her kingdom. Granted one wish, Merida must rely on her bravery and her archery skills to undo a beastly curse.",yes,no,
Kung Fu Panda 2,"Animation, Action, Adventure",90 min,2011,Jennifer Yuh Nelson,7.2,"301,845",81%,"Jack Black, Angelina Jolie, Jackie Chan",tt1302011,movie,PG,26-May-11,"Jonathan Aibel, Glenn Berger, Ethan Reiff","United States, Canada",Nominated for 1 Oscar. 5 wins & 47 nominations total,"Po and his friends fight to stop a peacock villain from conquering China with a deadly new weapon, but first the Dragon Warrior must come to terms with his past.",yes,no,
The Adventures of Tintin,"Animation, Action, Adventure",107 min,2011,Steven Spielberg,7.3,"238,286",74%,"Jamie Bell, Andy Serkis, Daniel Craig",tt0983193,movie,PG,21-Dec-11,"Hergé, Steven Moffat, Edgar Wright","United States, New Zealand, United Kingdom, France, Australia",Nominated for 1 Oscar. 22 wins & 63 nominations total,Intrepid reporter Tintin and Captain Haddock set off on a treasure hunt for a sunken ship commanded by Haddock's ancestor.,yes,no,
Shrek 2,"Animation, Adventure, Comedy",93 min,2004,"Andrew Adamson, Kelly Asbury, Conrad Vernon",7.3,"486,021",89%,"Mike Myers, Eddie Murphy, Cameron Diaz",tt0298148,movie,PG,19-May-04,"William Steig, Andrew Adamson, Joe Stillman","United States, Canada",Nominated for 2 Oscars. 18 wins & 52 nominations total,"Shrek and Fiona travel to the Kingdom of Far Far Away, where Fiona's parents are King and Queen, to celebrate their marriage. When they arrive, they find they are not as welcome as they thought they would be.",yes,no,
Megamind,"Animation, Action, Comedy",95 min,2010,Tom McGrath,7.3,"280,920",72%,"Will Ferrell, Jonah Hill, Brad Pitt",tt1001526,movie,PG,5-Nov-10,"Alan Schoolcraft, Brent Simons","United States, Australia",2 wins & 16 nominations,"Evil genius Megamind finally defeats his do-gooder nemesis, Metro Man, but is left without a purpose in a superhero-free world.",yes,no,
The Emperor's New Groove,"Animation, Adventure, Comedy",78 min,2000,Mark Dindal,7.4,"215,791",86%,"David Spade, John Goodman, Eartha Kitt",tt0120917,movie,G,15-Dec-00,"Chris Williams, Mark Dindal, David Reynolds","United States, Japan",Nominated for 1 Oscar. 7 wins & 27 nominations total,"Emperor Kuzco is turned into a llama by his ex-administrator Yzma, and must now regain his throne with the help of Pacha, the gentle llama herder.",yes,no,
One Hundred and One Dalmatians,"Animation, Adventure, Comedy",79 min,1961,"Clyde Geronimi, Hamilton Luske, Wolfgang Reitherman",7.3,"175,854",98%,"Rod Taylor, Betty Lou Gerson, J. Pat O'Malley",tt0055254,movie,G,25-Jan-61,"Bill Peet, Dodie Smith",United States,Won 1 BAFTA Award1 win & 1 nomination total,"When a litter of Dalmatian puppies are abducted by the minions of Cruella De Vil, the owners must find them before she uses them for a diabolical fashion statement.",yes,no,
The Fox and the Hound,"Animation, Adventure, Drama",83 min,1981,"Ted Berman, Richard Rich, Art Stevens",7.2,"98,092",72%,"Mickey Rooney, Kurt Russell, Pearl Bailey",tt0082406,movie,G,10-Jul-81,"Daniel P. Mannix, Larry Clemmons, Ted Berman",United States,1 win & 2 nominations,"A fox named Tod and a hound named Copper vow to be best friends forever. But as Copper grows into a hunting dog, their unlikely friendship faces the ultimate test.",yes,no,
The Sword in the Stone,"Animation, Adventure, Comedy",79 min,1963,"Wolfgang Reitherman, Clyde Geronimi, David Hand",7.1,"102,942",67%,"Rickie Sorensen, Sebastian Cabot, Karl Swenson",tt0057546,movie,G,21-Jun-64,"Bill Peet, T.H. White",United States,Nominated for 1 Oscar. 1 win & 1 nomination total,"A poor boy named Arthur learns the power of love, kindness, knowledge and bravery with the help of a wizard called Merlin in the path to become one of the most beloved kings in English history.",yes,no,
Frankenweenie,"Animation, Comedy, Drama",87 min,2012,Tim Burton,6.9,"112,794",88%,"Winona Ryder, Catherine O'Hara, Martin Short",tt1142977,movie,PG,5-Oct-12,"Leonard Ripps, Tim Burton, John August","United States, United Kingdom",Nominated for 1 Oscar. 11 wins & 50 nominations total,"When a boy's beloved dog passes away suddenly, he attempts to bring the animal back to life through a powerful science experiment.",yes,no,
Tarzan,"Animation, Adventure, Comedy",88 min,1999,"Chris Buck, Kevin Lima",7.3,"237,854",89%,"Tony Goldwyn, Minnie Driver, Brian Blessed",tt0120855,movie,G,18-Jun-99,"Tab Murphy, Bob Tzudiker, Noni White","United States, Japan",Won 1 Oscar. 11 wins & 23 nominations total,A man raised by gorillas must decide where he really belongs when he discovers he is a human.,yes,no,
Bolt,"Animation, Adventure, Comedy",96 min,2008,"Byron Howard, Chris Williams",6.8,"221,310",90%,"John Travolta, Miley Cyrus, Susie Essman",tt0397892,movie,PG,21-Nov-08,"Dan Fogelman, Chris Williams","United States, Japan",Nominated for 1 Oscar. 1 win & 32 nominations total,The canine star of a fictional sci-fi/action show that believes his powers are real embarks on a cross country trek to save his co-star from a threat he believes is just as real.,yes,no,
The Croods,"Animation, Action, Adventure",98 min,2013,"Kirk DeMicco, Chris Sanders",7.2,"224,389",71%,"Nicolas Cage, Ryan Reynolds, Emma Stone",tt0481499,movie,PG,22-Mar-13,"Kirk DeMicco, Chris Sanders, John Cleese",United States,Nominated for 1 Oscar. 5 wins & 46 nominations total,"After their cave is destroyed, a caveman family must trek through an unfamiliar fantastical world with the help of an inventive boy.",yes,no,
Hotel Transylvania,"Animation, Adventure, Comedy",91 min,2012,Genndy Tartakovsky,7,"269,026",44%,"Adam Sandler, Kevin James, Andy Samberg",tt0837562,movie,PG,28-Sep-12,"Peter Baynham, Robert Smigel, Todd Durham","United States, Canada",2 wins & 15 nominations,"Dracula, who operates a high-end resort away from the human world, goes into overprotective mode when a boy discovers the resort and falls for the count's teenaged daughter.",yes,no,
Hercules,"Animation, Adventure, Comedy",93 min,1997,"Ron Clements, John Musker",7.3,"244,304",82%,"Tate Donovan, Susan Egan, James Woods",tt0119282,movie,G,27-Jun-97,"Ron Clements, John Musker, Don McEnery","United States, Japan",Nominated for 1 Oscar. 9 wins & 16 nominations total,The son of Zeus and Hera is stripped of his immortality as an infant and must become a true hero in order to reclaim it.,yes,no,
Rio,"Animation, Adventure, Comedy",96 min,2011,Carlos Saldanha,6.9,"239,537",72%,"Jesse Eisenberg, Anne Hathaway, George Lopez",tt1436562,movie,PG,15-Apr-11,"Carlos Saldanha, Earl Richey Jones, Todd R. Jones","United States, United Kingdom",Nominated for 1 Oscar. 3 wins & 31 nominations total,"When Blu, a domesticated macaw from small-town Minnesota, meets the fiercely independent Jewel, he takes off on an adventure to Rio de Janeiro with the bird of his dreams.",yes,no,
The Princess and the Frog,"Animation, Adventure, Comedy",97 min,2009,"Ron Clements, John Musker",7.1,"157,353",85%,"Anika Noni Rose, Keith David, Oprah Winfrey",tt0780521,movie,G,11-Dec-09,"Ron Clements, John Musker, Greg Erb","United States, Japan",Nominated for 3 Oscars. 10 wins & 42 nominations total,"A waitress, desperate to fulfill her dreams as a restaurant owner, is set on a journey to turn a frog prince back into a human being, but she has to face the same problem after she kisses him.",yes,no,
Madagascar,"Animation, Adventure, Comedy",86 min,2005,"Eric Darnell, Tom McGrath",6.9,"421,668",55%,"Chris Rock, Ben Stiller, David Schwimmer",tt0351283,movie,PG,27-May-05,"Mark Burton, Billy Frolick, Eric Darnell","United States, Canada",4 wins & 32 nominations,"A group of animals who have spent all their life in a New York zoo end up in the jungles of Madagascar, and must adjust to living in the wild.",yes,no,
Treasure Planet,"Animation, Adventure, Family",95 min,2002,"Ron Clements, John Musker",7.2,"126,489",69%,"Joseph Gordon-Levitt, Emma Thompson, Martin Short",tt0133240,movie,PG,27-Nov-02,"Robert Louis Stevenson, Ron Clements, John Musker","United States, Japan",Nominated for 1 Oscar. 1 win & 14 nominations total,"In this science fiction rendering of the classic novel ""Treasure Island"", Jim Hawkins (Joseph Gordon-Levitt) is a rebellious teen seen by the world as an aimless slacker. After he receives a map from a dying pirate, he embarks on ...",yes,no,
Puss in Boots,"Animation, Adventure, Comedy",90 min,2011,Chris Miller,6.6,"184,121",86%,"Antonio Banderas, Salma Hayek, Zach Galifianakis",tt0448694,movie,PG,28-Oct-11,"Tom Wheeler, Brian Lynch, Will Davies","United States, India",Nominated for 1 Oscar. 9 wins & 43 nominations total,"An outlaw cat, his childhood egg-friend, and a seductive thief kitty set out in search for the eggs of the fabled Golden Goose to clear his name, restore his lost honor, and regain the trust of his mother and town.",yes,no,
Kung Fu Panda 3,"Animation, Action, Adventure",95 min,2016,"Alessandro Carloni, Jennifer Yuh Nelson",7.1,"173,305",86%,"Jack Black, Bryan Cranston, Dustin Hoffman",tt2267968,movie,PG,29-Jan-16,"Jonathan Aibel, Glenn Berger, Ethan Reiff","China, United States",1 win & 10 nominations,"Continuing his ""legendary adventures of awesomeness"", Po must face two hugely epic, but different threats: one supernatural and the other a little closer to home.",yes,no,
Zootopia,"Animation, Adventure, Comedy",108 min,2016,"Byron Howard, Rich Moore, Jared Bush",8,"522,760",98%,"Ginnifer Goodwin, Jason Bateman, Idris Elba",tt2948356,movie,PG,4-Mar-16,"Byron Howard, Rich Moore, Jared Bush",United States,Won 1 Oscar. 48 wins & 75 nominations total,"In a city of anthropomorphic animals, a rookie bunny cop and a cynical con artist fox must work together to uncover a conspiracy.",yes,no,
Soul,"Animation, Adventure, Comedy",100 min,2020,"Pete Docter, Kemp Powers",8,"351,946",95%,"Jamie Foxx, Tina Fey, Graham Norton",tt2948372,movie,PG,25-Dec-20,"Pete Docter, Mike Jones, Kemp Powers","United States, Japan",Won 2 Oscars. 124 wins & 93 nominations total,"After landing the gig of a lifetime, a New York jazz pianist suddenly finds himself trapped in a strange land between Earth and the afterlife.",yes,no,
The Red Turtle,"Animation, Drama, Family",80 min,2016,Michael Dudok de Wit,7.5,"36,942",93%,"Emmanuel Garijo, Tom Hudson, Baptiste Goy",tt3666024,movie,PG,20-Jan-17,"Michael Dudok de Wit, Pascale Ferran","France, Belgium, Japan",Nominated for 1 Oscar. 13 wins & 34 nominations total,"A man is shipwrecked on a deserted island and encounters a red turtle, which changes his life.",yes,no,
Pom Poko,"Animation, Comedy, Drama",119 min,1994,Isao Takahata,7.3,"32,496",86%,"Shinchô Kokontei, Makoto Nonomura, Yuriko Ishida",tt0110008,movie,PG,25-Dec-95,"Hayao Miyazaki, Isao Takahata",Japan,3 wins & 1 nomination,A community of magical shape-shifting raccoon dogs struggle to prevent their forest home from being destroyed by urban development.,yes,no,
Lupin III: The Castle of Cagliostro,"Animation, Action, Adventure",102 min,1979,Hayao Miyazaki,7.6,"31,964",95%,"Yasuo Yamada, Eiko Masuyama, Kiyoshi Kobayashi",tt0079833,movie,PG-13,15-Dec-79,"Monkey Punch, Hayao Miyazaki, Haruya Yamazaki",Japan,1 win & 1 nomination,"A dashing thief, his gang of desperadoes and an intrepid cop struggle to free a princess from an evil count, and learn the secret of a treasure that she holds part of the key to.",yes,no,
Tokyo Godfathers,"Animation, Adventure, Comedy",92 min,2003,Satoshi Kon,7.8,"43,750",91%,"Tôru Emori, Yoshiaki Umegaki, Aya Okamoto",tt0388473,movie,PG-13,8-Nov-03,"Satoshi Kon, Keiko Nobumoto",Japan,8 wins & 1 nomination,"On Christmas Eve, three homeless people living on the streets of Tokyo discover a newborn baby among the trash and set out to find its parents.",yes,no,
Whisper of the Heart,"Animation, Drama, Family",111 min,1995,Yoshifumi Kondô,7.8,"67,815",94%,"Yoko Honna, Issey Takahashi, Takashi Tachibana",tt0113824,movie,G,13-Dec-96,"Hayao Miyazaki, Aoi Hiiragi, Cindy Davis",Japan,N/A,"A love story between a girl who loves reading books, and a boy who has previously checked out all of the library books she chooses.",yes,no,
The Illusionist,"Drama, Fantasy, Mystery",110 min,2006,Neil Burger,7.5,"382,115",73%,"Edward Norton, Jessica Biel, Paul Giamatti",tt0443543,movie,PG-13,1-Sep-06,"Neil Burger, Steven Millhauser","United States, Czech Republic",Nominated for 1 Oscar. 11 wins & 12 nominations total,"In turn-of-the-century Vienna, a magician uses his abilities to secure the love of a woman far above his social standing.",yes,no,
Animal Farm,"Animation, Drama",72 min,1954,"Joy Batchelor, John Halas",7.2,"18,319",69%,"Gordon Heath, Maurice Denham",tt0047834,movie,Approved,19-Jun-59,"George Orwell, Lothar Wolff, Borden Mace","United Kingdom, United States",Nominated for 1 BAFTA Award1 nomination total,A successful farmyard revolution by the resident animals vs. the farmer goes horribly wrong as the victors create a new tyranny among themselves.,yes,no,
Only Yesterday,"Animation, Drama, Romance",119 min,1991,Isao Takahata,7.6,"34,982",100%,"Miki Imai, Toshirô Yanagiba, Yoko Honna",tt0102587,movie,PG,26-Feb-16,"Hotaru Okamoto, Yuuko Tone, David Freedman",Japan,1 win & 8 nominations,A twenty-seven-year-old office worker travels to the countryside while reminiscing about her childhood in Tokyo.,yes,no,
The Lord of the Rings,"Animation, Adventure, Fantasy",132 min,1978,Ralph Bakshi,6.2,"34,803",50%,"Christopher Guard, William Squire, Michael Scholes",tt0077869,movie,PG,15-Nov-78,"Chris Conkling, Peter S. Beagle, J.R.R. Tolkien","United States, United Kingdom, Spain",1 win & 3 nominations,The Fellowship of the Ring embark on a journey to destroy the One Ring and end Sauron's reign over Middle-earth.,yes,no,
Kubo and the Two Strings,"Animation, Action, Adventure",101 min,2016,Travis Knight,7.7,"134,958",97%,"Charlize Theron, Art Parkinson, Matthew McConaughey",tt4302938,movie,PG,19-Aug-16,"Marc Haimes, Chris Butler, Shannon Tindle","United Kingdom, United States",Nominated for 2 Oscars. 33 wins & 67 nominations total,A young boy named Kubo must locate a magical suit of armour worn by his late father in order to defeat a vengeful spirit from the past.,yes,no,
Gulliver's Travels,"Animation, Adventure, Comedy",76 min,1939,"Dave Fleischer, Willard Bowsky, Orestes Calpini",6.6,"4,650",69%,"Jessica Dragonette, Lanny Ross, Pinto Colvig",tt0031397,movie,Passed,22-Dec-39,"Jonathan Swift, Edmond Seward, Dan Gordon",United States,Nominated for 2 Oscars. 2 nominations total,A doctor washes ashore on an island inhabited by little people.,yes,no,
The Bugs Bunny/Road-Runner Movie,"Animation, Comedy, Family",98 min,1979,"Chuck Jones, Phil Monroe, Maurice Noble",7.2,"4,323",100%,"Mel Blanc, Arthur Q. Bryan, Paul Julian",tt0078915,movie,G,28-Sep-79,"Michael Maltese, Chuck Jones, John W. Dunn",United States,1 nomination,Bugs Bunny reflects on his past cartoon exploits.,yes,no,
The Mitchells vs the Machines,"Animation, Adventure, Comedy",114 min,2021,"Michael Rianda, Jeff Rowe",7.6,"119,511",97%,"Abbi Jacobson, Danny McBride, Maya Rudolph",tt7979580,movie,PG,30-Apr-21,"Michael Rianda, Jeff Rowe, Peter Szilagyi","United States, Hong Kong",Nominated for 1 Oscar. 46 wins & 59 nominations total,"A quirky, dysfunctional family's road trip is upended when they find themselves in the middle of the robot apocalypse and suddenly become humanity's unlikeliest last hope.",yes,no,
Ernest et Célestine en hiver,Animation,45 min,2017,N/A,6.3,18,N/A,N/A,tt10443634,movie,N/A,22-Nov-17,N/A,France,N/A,"Ernest is a big bear who loves music and jam. Celestine is a tiny mouse he adopted. The unusual family welcomes the first snowflakes of the season, and the events that delay Ernest's hibernation.",yes,no,
Robin Hood,"Action, Adventure, Drama",140 min,2010,Ridley Scott,6.6,"276,706",43%,"Russell Crowe, Cate Blanchett, Matthew Macfadyen",tt0955308,movie,PG-13,14-May-10,"Brian Helgeland, Ethan Reiff, Cyrus Voris","United States, United Kingdom",1 win & 14 nominations,"In twelfth-century England, Robin Longstride and his band of marauders confront corruption in a local village and lead an uprising against the crown that will forever alter the balance of world power.",yes,no,
Vi,Drama,92 min,2013,Mani Maserrat-Agah,5.3,"1,024",N/A,"Gustaf Skarsgård, Anna Åström, Rebecca Ferguson",tt2708782,movie,N/A,10-May-13,Jens Jonsson,Sweden,N/A,This is a story of IDA and KRISTER. It's about a relationship that goes to hell. They are both crazy in love but manage to strangle the supply of oxygen and adapt to each other in a way that will lead to catastrophic consequences.,yes,no,
Shikshanachya Aaicha Gho,Comedy,103 min,2010,Mahesh Manjrekar,6.9,298,N/A,"Bharat Jadhav, Siddarth Jadhav, Rajdev Jamdade",tt2321513,movie,Not Rated,15-Jan-10,"Mahesh Manjrekar, Guru Thakur",India,N/A,An indebted father regrets putting his teenage son in a coma over poor school grades and takes it out on the school system.,yes,no,
